[
 {
  "id": "PER-001",
  "shuhra": "عبد الرحمن الداخل",
  "latin": "ʿAbd al-Raḥmān I",
  "birth": 731,
  "death": 788,
  "date_note": "",
  "roles": [
   "أمير"
  ],
  "places": [
   "PLC-001"
  ],
  "name": {
   "ism": "عبد الرحمن",
   "kunya": "أبو المطرف",
   "nasab": "بن معاوية بن هشام بن عبد الملك",
   "nisba": [
    "الأموي"
   ],
   "laqab": "الداخل",
   "origin": "ref — معرفة مرجعية عامة تُطابق قبل النشر"
  },
  "tenures": [
   {
    "id": "TEN-001",
    "polity": "POL-001",
    "role": "أمير",
    "start": 756,
    "end": 788,
    "precision": "سنة"
   }
  ]
 },
 {
  "id": "PER-002",
  "shuhra": "عبد الرحمن الثالث الناصر",
  "latin": "ʿAbd al-Raḥmān III",
  "birth": 891,
  "death": 961,
  "date_note": "ولد 22 رمضان 277هـ (= 7 يناير 891م بالتحويل الجدولي)؛ صُحح من 889 في v5.2",
  "roles": [
   "أمير",
   "خليفة"
  ],
  "places": [
   "PLC-001",
   "PLC-002"
  ],
  "name": {
   "ism": "عبد الرحمن",
   "kunya": "أبو المطرف",
   "nasab": "بن محمد بن عبد الله",
   "nisba": [
    "الأموي"
   ],
   "laqab": "الناصر لدين الله",
   "origin": "ref — معرفة مرجعية عامة تُطابق قبل النشر"
  },
  "tenures": [
   {
    "id": "TEN-002a",
    "polity": "POL-001",
    "role": "أمير",
    "start": 912,
    "end": 929,
    "precision": "سنة"
   },
   {
    "id": "TEN-002b",
    "polity": "POL-002",
    "role": "خليفة",
    "start": 929,
    "end": 961,
    "precision": "سنة"
   }
  ]
 },
 {
  "id": "PER-003",
  "shuhra": "الحكم المستنصر بالله",
  "latin": "al-Ḥakam II",
  "birth": 915,
  "death": 976,
  "date_note": "",
  "roles": [
   "خليفة"
  ],
  "places": [
   "PLC-001"
  ],
  "name": {
   "ism": "الحكم",
   "kunya": "أبو العاص",
   "nasab": "بن عبد الرحمن الناصر",
   "nisba": [
    "الأموي"
   ],
   "laqab": "المستنصر بالله",
   "origin": "ref — معرفة مرجعية عامة تُطابق قبل النشر"
  },
  "tenures": [
   {
    "id": "TEN-003",
    "polity": "POL-002",
    "role": "خليفة",
    "start": 961,
    "end": 976,
    "precision": "سنة"
   }
  ]
 },
 {
  "id": "PER-004",
  "shuhra": "المنصور ابن أبي عامر",
  "latin": "al-Manṣūr Ibn Abī ʿĀmir",
  "birth": 939,
  "death": 1002,
  "date_note": "توفي 27 رمضان 392هـ (أغسطس 1002م) بمدينة سالم (البيان المغرب)؛ 393هـ عند الحميدي؛ المولد نحو 326–328هـ (938–940م)",
  "roles": [
   "حاجب",
   "قائد"
  ],
  "places": [
   "PLC-001",
   "PLC-D03"
  ],
  "name": {
   "ism": "محمد",
   "kunya": "أبو عامر",
   "nasab": "بن عبد الله بن أبي عامر",
   "nisba": [
    "المعافري"
   ],
   "laqab": "المنصور",
   "origin": "ref — معرفة مرجعية عامة تُطابق قبل النشر"
  },
  "tenures": []
 },
 {
  "id": "PER-005",
  "shuhra": "ابن حيان القرطبي",
  "latin": "Ibn Ḥayyān",
  "birth": 987,
  "death": 1076,
  "date_note": "",
  "roles": [
   "مؤرخ"
  ],
  "places": [
   "PLC-001"
  ],
  "name": {
   "ism": "حيان",
   "kunya": "أبو مروان",
   "nasab": "بن خلف بن حسين بن حيان",
   "nisba": [
    "القرطبي"
   ],
   "laqab": "",
   "origin": "ref — معرفة مرجعية عامة تُطابق قبل النشر"
  },
  "tenures": []
 },
 {
  "id": "PER-006",
  "shuhra": "ابن حزم",
  "latin": "Ibn Ḥazm",
  "birth": 994,
  "death": 1064,
  "date_note": "",
  "roles": [
   "فقيه",
   "أديب"
  ],
  "places": [
   "PLC-001"
  ],
  "name": {
   "ism": "علي",
   "kunya": "أبو محمد",
   "nasab": "بن أحمد بن سعيد بن حزم",
   "nisba": [
    "القرطبي",
    "الظاهري"
   ],
   "laqab": "",
   "origin": "ref — معرفة مرجعية عامة تُطابق قبل النشر"
  },
  "tenures": []
 },
 {
  "id": "PER-007",
  "shuhra": "ابن زيدون",
  "latin": "Ibn Zaydūn",
  "birth": 1003,
  "death": 1071,
  "date_note": "",
  "roles": [
   "شاعر",
   "كاتب"
  ],
  "places": [
   "PLC-001",
   "PLC-004"
  ],
  "name": {
   "ism": "أحمد",
   "kunya": "أبو الوليد",
   "nasab": "بن عبد الله بن زيدون",
   "nisba": [
    "المخزومي"
   ],
   "laqab": "",
   "origin": "ref — معرفة مرجعية عامة تُطابق قبل النشر"
  },
  "tenures": []
 },
 {
  "id": "PER-008",
  "shuhra": "ولادة بنت المستكفي",
  "latin": "Wallāda bint al-Mustakfī",
  "birth": null,
  "death": null,
  "date_note": "نحو 994–1091م",
  "roles": [
   "شاعرة"
  ],
  "places": [
   "PLC-001"
  ],
  "name": {
   "ism": "ولادة",
   "kunya": "",
   "nasab": "بنت محمد المستكفي",
   "nisba": [
    "الأموية"
   ],
   "laqab": "",
   "origin": "ref — معرفة مرجعية عامة تُطابق قبل النشر"
  },
  "tenures": []
 },
 {
  "id": "PER-009",
  "shuhra": "المعتمد بن عباد",
  "latin": "al-Muʿtamid ibn ʿAbbād",
  "birth": 1040,
  "death": 1095,
  "date_note": "",
  "roles": [
   "ملك طائفة",
   "شاعر"
  ],
  "places": [
   "PLC-004"
  ],
  "name": {
   "ism": "محمد",
   "kunya": "أبو القاسم",
   "nasab": "بن عباد بن محمد",
   "nisba": [],
   "laqab": "المعتمد على الله",
   "origin": "ref — معرفة مرجعية عامة تُطابق قبل النشر"
  },
  "tenures": [
   {
    "id": "TEN-004",
    "polity": "POL-003",
    "role": "ملك طائفة",
    "start": 1069,
    "end": 1091,
    "precision": "سنة"
   }
  ]
 },
 {
  "id": "PER-010",
  "shuhra": "ابن عمار",
  "latin": "Ibn ʿAmmār",
  "birth": 1031,
  "death": 1086,
  "date_note": "",
  "roles": [
   "شاعر",
   "وزير"
  ],
  "places": [
   "PLC-004",
   "PLC-014"
  ],
  "name": {
   "ism": "",
   "kunya": "",
   "nasab": "",
   "nisba": [],
   "laqab": "",
   "origin": "فارغ عمدًا"
  },
  "tenures": []
 },
 {
  "id": "PER-011",
  "shuhra": "صاعد الأندلسي",
  "latin": "Ṣāʿid al-Andalusī",
  "birth": 1029,
  "death": 1070,
  "date_note": "",
  "roles": [
   "قاضٍ",
   "مؤرخ علوم"
  ],
  "places": [
   "PLC-005"
  ],
  "name": {
   "ism": "صاعد",
   "kunya": "أبو القاسم",
   "nasab": "بن أحمد",
   "nisba": [
    "الأندلسي",
    "الطليطلي"
   ],
   "laqab": "",
   "origin": "ref — معرفة مرجعية عامة تُطابق قبل النشر"
  },
  "tenures": []
 },
 {
  "id": "PER-012",
  "shuhra": "الزهراوي",
  "latin": "al-Zahrāwī",
  "birth": null,
  "death": null,
  "date_note": "توفي بعد 400هـ (الصلة ص162)، وعاصره ابن حزم (رسائله ج2 ص185)؛ نحو 936–1013م عند Britannica، والوفاة 427هـ/1036م عند الزركلي — لا نص أوليًا بسنة الوفاة",
  "roles": [
   "طبيب"
  ],
  "places": [
   "PLC-001",
   "PLC-002"
  ],
  "name": {
   "ism": "خلف",
   "kunya": "أبو القاسم",
   "nasab": "بن عباس",
   "nisba": [
    "الزهراوي"
   ],
   "laqab": "",
   "origin": "ref — معرفة مرجعية عامة تُطابق قبل النشر"
  },
  "tenures": []
 },
 {
  "id": "PER-013",
  "shuhra": "الزرقالي",
  "latin": "al-Zarqālī",
  "birth": null,
  "death": null,
  "date_note": "القرن 11م",
  "roles": [
   "فلكي"
  ],
  "places": [
   "PLC-005"
  ],
  "name": {
   "ism": "إبراهيم",
   "kunya": "أبو إسحاق",
   "nasab": "بن يحيى",
   "nisba": [
    "النقاش"
   ],
   "laqab": "الزرقالي",
   "origin": "ref — معرفة مرجعية عامة تُطابق قبل النشر"
  },
  "tenures": []
 },
 {
  "id": "PER-014",
  "shuhra": "ابن باجة",
  "latin": "Ibn Bājja",
  "birth": null,
  "death": 1139,
  "date_note": "",
  "roles": [
   "فيلسوف",
   "طبيب"
  ],
  "places": [
   "PLC-006"
  ],
  "name": {
   "ism": "",
   "kunya": "",
   "nasab": "",
   "nisba": [],
   "laqab": "",
   "origin": "فارغ عمدًا"
  },
  "tenures": []
 },
 {
  "id": "PER-015",
  "shuhra": "ابن طفيل",
  "latin": "Ibn Ṭufayl",
  "birth": null,
  "death": 1185,
  "date_note": "نحو 1105–1185م",
  "roles": [
   "فيلسوف",
   "طبيب"
  ],
  "places": [
   "PLC-003",
   "PLC-C06"
  ],
  "name": {
   "ism": "محمد",
   "kunya": "أبو بكر",
   "nasab": "بن عبد الملك بن طفيل",
   "nisba": [
    "القيسي"
   ],
   "laqab": "",
   "origin": "ref — معرفة مرجعية عامة تُطابق قبل النشر"
  },
  "tenures": []
 },
 {
  "id": "PER-016",
  "shuhra": "ابن رشد",
  "latin": "Ibn Rushd",
  "birth": 1126,
  "death": 1198,
  "date_note": "",
  "roles": [
   "فيلسوف",
   "فقيه",
   "طبيب",
   "قاضٍ"
  ],
  "places": [
   "PLC-001",
   "PLC-004"
  ],
  "name": {
   "ism": "محمد",
   "kunya": "أبو الوليد",
   "nasab": "بن أحمد بن محمد بن رشد",
   "nisba": [
    "القرطبي"
   ],
   "laqab": "الحفيد",
   "origin": "ref — معرفة مرجعية عامة تُطابق قبل النشر"
  },
  "tenures": []
 },
 {
  "id": "PER-017",
  "shuhra": "ابن عربي",
  "latin": "Ibn ʿArabī",
  "birth": 1165,
  "death": 1240,
  "date_note": "",
  "roles": [
   "متصوف"
  ],
  "places": [
   "PLC-011",
   "PLC-004"
  ],
  "name": {
   "ism": "محمد",
   "kunya": "أبو بكر",
   "nasab": "بن علي بن محمد",
   "nisba": [
    "الحاتمي",
    "الطائي"
   ],
   "laqab": "محيي الدين",
   "origin": "ref — معرفة مرجعية عامة تُطابق قبل النشر"
  },
  "tenures": []
 },
 {
  "id": "PER-018",
  "shuhra": "لسان الدين ابن الخطيب",
  "latin": "Ibn al-Khaṭīb",
  "birth": 1313,
  "death": 1374,
  "date_note": "ولد 25 رجب 713هـ (نوفمبر 1313م) بنص الإحاطة ج4 ص548؛ قُتل خنقًا في سجنه بفاس سنة 776هـ، بين مستهلّها وشوالها (منتصف 1374م إلى أوائل 1375م) بحسب ابن خلدون: العبر ج7 ص452–453، والرحلة ص187",
  "roles": [
   "وزير",
   "مؤرخ",
   "أديب"
  ],
  "places": [
   "PLC-003"
  ],
  "name": {
   "ism": "محمد",
   "kunya": "أبو عبد الله",
   "nasab": "بن عبد الله",
   "nisba": [
    "السلماني"
   ],
   "laqab": "لسان الدين",
   "origin": "ref — معرفة مرجعية عامة تُطابق قبل النشر"
  },
  "tenures": []
 },
 {
  "id": "PER-019",
  "shuhra": "ابن سعيد المغربي",
  "latin": "Ibn Saʿīd al-Maghribī",
  "birth": 1213,
  "death": 1286,
  "date_note": "",
  "roles": [
   "جغرافي",
   "أديب"
  ],
  "places": [],
  "name": {
   "ism": "علي",
   "kunya": "أبو الحسن",
   "nasab": "بن موسى بن سعيد",
   "nisba": [
    "المغربي"
   ],
   "laqab": "",
   "origin": "ref — معرفة مرجعية عامة تُطابق قبل النشر"
  },
  "tenures": []
 },
 {
  "id": "PER-020",
  "shuhra": "الإدريسي",
  "latin": "al-Idrīsī",
  "birth": null,
  "death": null,
  "date_note": "نحو 1100–1165/66م",
  "roles": [
   "جغرافي"
  ],
  "places": [],
  "name": {
   "ism": "محمد",
   "kunya": "أبو عبد الله",
   "nasab": "بن محمد",
   "nisba": [
    "الإدريسي"
   ],
   "laqab": "",
   "origin": "ref — معرفة مرجعية عامة تُطابق قبل النشر"
  },
  "tenures": []
 },
 {
  "id": "PER-021",
  "shuhra": "ابن البيطار",
  "latin": "Ibn al-Bayṭār",
  "birth": null,
  "death": 1248,
  "date_note": "",
  "roles": [
   "عالم نبات"
  ],
  "places": [
   "PLC-010"
  ],
  "name": {
   "ism": "عبد الله",
   "kunya": "أبو محمد",
   "nasab": "بن أحمد",